1,1,0.01639344262295082,MyAgent@0,(Offer  bid:Bid[Food: Handmade Food, Drinks: Beer Only, Location: Party Room, Invitations: Plain, Music: DJ, Cleanup: Water and Soap])
1,2,0.01639344262295082,TimeDependentAgentLinear@1,(Offer  bid:Bid[Food: Catering, Drinks: Handmade Cocktails, Location: Party Room, Invitations: Plain, Music: MP3, Cleanup: Water and Soap])
2,1,0.03278688524590164,MyAgent@0,(Offer  bid:Bid[Food: Chips and Nuts, Drinks: Beer Only, Location: Party Tent, Invitations: Photo, Music: DJ, Cleanup: Water and Soap])
2,2,0.03278688524590164,TimeDependentAgentLinear@1,(Offer  bid:Bid[Food: Handmade Food, Drinks: Handmade Cocktails, Location: Party Room, Invitations: Custom, Printed, Music: MP3, Cleanup: Water and Soap])
3,1,0.04918032786885246,MyAgent@0,(Offer  bid:Bid[Food: Chips and Nuts, Drinks: Beer Only, Location: Party Room, Invitations: Custom, Handmade, Music: Band, Cleanup: Hired Help])
3,2,0.04918032786885246,TimeDependentAgentLinear@1,(Offer  bid:Bid[Food: Handmade Food, Drinks: Handmade Cocktails, Location: Party Room, Invitations: Plain, Music: MP3, Cleanup: Water and Soap])
4,1,0.06557377049180328,MyAgent@0,(Offer  bid:Bid[Food: Catering, Drinks: Beer Only, Location: Ballroom, Invitations: Photo, Music: DJ, Cleanup: Specialized Materials])
